"No future for public transport is one of the worst things in our life. <unk>, the state makes no effort to fight it. Transportation now is very overcrowded and difficult, especially in the rush hour when people leave their jobs and go to their houses at 2 o'clock. The main reason for that is the increasing number of people in our country (housing problems) and the result of that is a lot of accidents have happened and a lot of people have died. A recent U.S. study revealed that using buses and trains regularly maintains the agility of the body and helps in reducing weight. According to a study published by the<unk> ""American Journal of Medicine Brevintev"" in August <unk> there is more public transport in cities where the population has become leaner and healthier. The U.S. researchers from two universities in the state of<unk> and the Foundation ""Rand"" American research and development staff to monitor <unk> regularly use public transportation or go to work by car in a year. The study results showed that people who use transportation <unk>. The public decreased their weight by three<unk>s on average, compared to people who use a car to travel and the study attributed this result to walking to the bus stop and running to catch the bus <unk>, while this does not happen with motorists. The study pointed out that the public transport network in the United States has not been expanded for a long time compared to the situation in Germany, for example. It appealed to experts in political circles in the United States to invest more money in public transportation and improve security <unk> in cities and make them more attractive to encourage people to use public transport. The supervisor of the study, John M. MacDonald of the University of<unk>, ""<unk>ment in public transport will allow the possibility of reducing obesity"". The transport sector in Arab countries suffers from many shortcomings and poor performance and is a cause of environmental pollution and this is due primarily to a lack of the capacity of public institutions to develop strategies necessary to intervene appropriately and<unk> investments effectively and improve the organizational capacity <unk>. <unk> to provide reliable and safe transportation and moderate costs and, in spite of the high demand for transportation services in the Arab countries, public transport systems are still undeveloped</s>"
"An intelligent person once said: 'The world is a book and those who do not travel read only one page.' I totally agree with this statement and, to my mind, people should travel a lot, because our world is incredible. But there is one more question: travel by car or public transport? First of all, of course, travelling by car is much more convenient than, for example, by bus. You can drive wherever and whenever you want. Even just in cities, let alone travelling long distances. But, on the other hand, a traffic jam or bad weather can make our trip inconvenient. Moreover, there are not many parking places in big cities. Secondly, travelling by public transport is much cheaper. Not everyone can afford to travel by car every day, so they choose public transport. Thirdly, we should take care of our environment! Cars pollute our air, which leads to many diseases such as asthma, allergies and even cancer. Moreover, cars release poisonous exhaust fumes and chemicals into the air, which mix with the water in the clouds, and the polluted rain, which later falls, damages trees, lakes and buildings. So, my advice is to travel by bicycle (or at least, use public transport), because it is environmentally friendly!</s>"
"Working as an ITC is very exciting because you need to program everything, it is like a challenge, although you can do different things. You can be on duty in your house and deal with your boss by cellphone, so don't be alarmed if your children bother you. It is a little stressful when you have a lot of work. I hope when I have my job I will be in charge of IT department security. It's a very worthwhile job.</s>"
"Sports are very beneficial for our health. I like to play football because it's a very exciting game. It takes only 90 minutes. Whenever I get the opportunity, I play football.</s>"
"<unk> with <unk>sal verbs First you must explode the old one and clean up the mess from the explosion. Second, paint the wall by yourself black paint until you pick up some of the painting skills, or you can use<unk>. It's very trendy and easy to put on the wall. The third step is, ""of course"", going to buy furniture from<unk>etta. Here are some tips you can take. if you are single, then you can buy a big cozy purple sofa with many colorful cushions to throw all over the place, but if you are married, then let your wife make the decision. Finally, if you have broken up recently, then don't do anything. Just light up your cigarette and hang out with yourex-girlfriend. Okay, let us get back to the<unk>.</s>"
"Peter looked at his watch and knew he had to do something immediately. It is said that when you survive a situation which has taken you to the limit, you change. And you can never return to being the person you used to be. You are no more the person that people knew. But you don't care about it. Every hard situation can be got over easily when you make a big effort. Peter had been thinking about this secret party for months, since the time he knew his mother was<unk>. He had been taking care of her, so he was prevented from going to university. He had to refuse all his dreams suddenly. However, destiny had given him another chance to follow them. Despite his strange behaviour, Peter's mum didn't expect it at all. She felt blessed as she had been given such a perfect son. It is said to happen once in a lifetime. Peter had been kissed by his mum before, but this time was quite different. Maybe he didn't notice it at all, but it was a farewell. Now Peter could fly on his own.</s>"
"The public transport system is overburdened today. The number of people using public transport far outstrips the number of people the transport system was designed to handle. The trains and buses are crowded, and newer routes do not reflect the changing demand. Mass production has made cars more affordable for the middle class in recent years. Also, the increase in<unk> income has given more buying power to consumers. Both these factors have led to increased purchasing of cars over the last few years. This trend is likely to continue in the future. Public transport cannot rival the sheer mobility that cars offer to their owners. Cars have the ability to take you from your home to your place of work without any <unk>. If you have to take a train, you have to reach the train station by walking, taking a taxi or taking a bus. Then, after you get off the train, you again have to find your way to your destination by either walking or using another mode of transport. Cars make it easier to transport children and luggage. They are safer and cleaner. Cars are here to stay. The same, however, cannot be said about public transport.</s>"
"I believe that my background is suitable for this position. My first degree gave me a good track record in physiology and<unk>, and the experience, as a biological sciences' student and as a research fellow, allowed me to build a scientific way of thinking. Furthermore, I have improved my skills in molecular, biochemical, bioin<unk>ics and<unk>r<unk> techniques, and I also would like to point out my high motivation to develop expertise in stem cells and pharmaceutical research. In addition, I am committed to science and I am a dedicated, team-oriented person, who is able to work independently.</s>"
"Thank you for your attention. There is one thing that confuses me, and that is the old extension number. I am always answering wrong calls, and these calls distract me. I receive a lot of calls looking for the previous employee and I have to spend my time explaining what happened to him. May I have a new extension number? Thanks for your help.</s>"
"Sorry that I haven <unk> t been in touch for a while, but I <unk> ve been really busy lately. How are you? Have you got anything new to tell me? Is everything OK with your family? Well, I have good news for you! I met a wonderful girl last week when I went to the cinema. I was in the queue when I saw her wearing a stylish tight black dress. She is perfect, with her long curly dark hair, and her pale skin. She has a wonderful body, but in her face you can see perfection. Her slanted eyes and her shiny lips are gorgeous. I want to introduce her asap! See you soon. Take care, José Lu<unk> s.</s>"
"If you have a car, you probably think that travelling by car is better than by bus, but there are a lot of people who don't have a car, so they are used to going by bus and, for them, this way of travelling has become more convenient, because they have done it since they were children. Therefore, whatever opinion you have is the result of the social situation in which you live.</s>"
"Hey John! How are things going over there? Is Ms. Gret<unk> still giving you trouble? Have you made any progress on your website project? I've been very busy lately. I've got a lot of assignments to work on. And this depressing weather is just making the situation worse. Anyway, I was thinking maybe you could help me out with this latest one. I'm supposed to do some research on eating customs around the world and I figured, instead of just doing a quick search on Google and <unk> something off a Wikipedia article, I'd ask you for a more direct source of input on the habits of the English. If I quote you in my work, I might score a few extra marks. So, what's the typical English approach to<unk> needs? Waiting to hear back from you, Your friend Hugo.</s>"
"My idol was, is, and always will be Justin Bieber. I remember the first time that I saw his videos. I didn't write his last name correctly and I couldn't find him on YouTube. It started when I was 12 or 13 years old, his music meant everything to me. He was always talking about following your dreams and never giving up. In 2014, I met a couple from One Direction called<unk> Stylinson but they couldn't ""come out"" because of their managers. I admire them because no matter what their managers make them go through, they always find a way to show us how much they love each other and how much they want to be free. I really hope in this ""hiatus"", this is what they called their break, they can be happy and spend time together without fake girlfriends, managers or the media around them. I want them to be happy. Anyway, talking about Justin again, I'm so proud of him, 2016 is his year and no one can deny that. </s>"
"In this essay I would like to highlight how a wide range of public transport can help people to save a bit of money and a lot of stressful hours stuck in traffic jams. First, as everybody knows, the cost of fuel is increasing more and more. <unk> to that the bills that owning a car will bring, it becomes immediately clear that it is cheaper to get around by public transport. Why then are there still so many people who prefer to drive their own car instead of sitting comfortably on the train or on the tube reading their favorite book on their way to work? I would say that this is because the public transport is not so efficient as it should be. In my town, for example, I have waited for up to forty minutes before I could get a bus. I strongly believe that it is a shame because a lot of people like me would leave their vehicles at home and take a train instead. Secondly, the environment would improve. As far as I can see, the pollution caused by traffic is ruining monuments and making the air dirty and heavy, the same is true as far as waste of time is concerned. Obviously, the fewer cars there are around, the quicker you can get where you want to go. In conclusion, I would really like politicians who care about public transport to improve the services so that more people could leave their vehicles at home and get around much more easily.</s>"
"Hi Jo, I'm glad to hear from you and I want you to come to Russia for your holidays. You know that Russia is a big country and there are a lot of places to visit. In our country there are a few different climate zones with very rich nature, and various cities with old and important history and culture. I'm pretty sure that your journey to Russia will be a very good and interesting experience. First of all, you can come to Moscow. As you know, Moscow is the capital of the Russian Federation. It<unk> s a very fast, energetic city with lots of things to do and to see. In the city there are a lot of museums and art galleries, theaters and clubs, a few parks which provide different events like open-air concerts or public muster-classes. Of course, you must visit Red Square, the Kremlin and Saint Basil's Cathedral. I strongly recommend you to book online tickets to the Big Theater and visit its opera or ballet. You know the Big Theater is one of the oldest in Russia with very rich traditions of ballet school. Maybe you remember the famous Diage<unk>'s seasons which were popular in Europe at the beginning of the 20th century. Nowadays, artists of the Theater try to keep that old school and develop their mastery. In addition, a few years ago, the Big Theater was restored and has regained its original appearance. There is no need to describe all the sightseeing in Moscow. You can easily find it on the Internet. I just want to say that I'm sure you'll like it a lot. After Moscow, you can visit the towns of the Gold<unk>. It's a group of the oldest Russian cities which were centers of the principalities during the ancient period of Russian history. There you can feel the spirit of antiquity and the huge contrast between Moscow and<unk> Russia. You will understand that people here and there are very different and their lifestyles are dissimilar. </s>"
"Dear Jo, It is absolutely <unk> to receive good news from an old friend who has been absent from my life for so long. I would be so happy to provide you with some accommodation while you stay in my country. I am currently working at a place where I am getting a great wage, so I have the possibility to accompany you on your journey. We could go to the most representative places in Mexico, such as <unk>lo mayor, Canc<unk> n, Acapulco, among many others. In Mexico, a foreign person does not face difficulties getting hired by a company. I would be pleased to help you with this part of your experience in my country. I know that you are someone who loves animals. Perhaps we could go to the city zoo in order to find out whether there are any vacancies that suit you? Something I can do is to do some research into places that need people who speak English fluently. As you know, in this country, if you are someone who speaks more than 1 language, you have the chance of getting a great job. Please let me know if you need anything extra while you are here. Maybe a special diet, special clothes or any kind of thing you might need that will not be easy to find here. Best regards, Luis </s>"
"Nowadays, television is very important in our lives because there are a lot of benefits and advantages to watching TV. There are lots of interesting programs suitable for people of every age. In my opinion, TV is useful because we can learn many interesting things and also reduce stress by watching TV. We can choose entertainment programs which are full of fun. Everyone can choose something suitable for them. We can find music programs which are wonderful for people who love listening to music and dancing. When we watch and listen to music we can learn foreign languages as well. Men usually choose sports programs, which are really popular on the TV nowadays. It is a cheaper way to watch their favourite team than spending money on an expensive ticket. Who does not like watching movies? Everybody loves watching movies! </s>"
"The map shows changes that have taken place in the town of Eastminster since 1999. During this period, the town has seen extensive growth in residential areas and local amenities, and the modernisation of leisure facilities. Parks in the north-east and south-east have been reduced to make way for larger housing estates, the one in the north dramatically increasing accommodation in Eastminister. As well as<unk> in the north-west being remodelled into an adventure park, a hotel and golf course have replaced a historic house and gardens in the centre of the town. South of the river, an industrial area has been constructed next to the existing railway, while residential streets have been converted into more modern apartment blocks. With increasing housing has come a bigger hospital and more shopping facilities, the existing shops being built on the site of the old school, with a new school opening on the north bank of the river.</s>"
"How did this happen? How can I be here at D’el Arte wearing a suit and tie with my beautiful wife? The day hadn’t been planned to end with a date night. Then it all dawned on me. I’d been set up. Duped, so to speak, into this unlikely event; a date night. Her plan was so clever and deceptive as to escape<unk> until the last card had been played. Oh, my wife is clever. When exactly did the deception begin? Was it at the party which lasted until 3am the night before? Was it the invitation to a wedding three weeks ago? How far back could it possibly go? When was this seed planted in my wife’s brain to have a date night with me all dressed up and formal? So many twists and turns. She played her cards well. I never suspected, while sitting in the pews next to my wife, that, when she leaned forward with a pained expression on her face, the evening would end at D’el Arte. Nor when her condition appeared to worsen and I decided to go get the car to take her to the doctor’s surgery. Nor when I returned to find her lying on the cold hard stone floor of the church, could I have ever imagined we would be enjoying a quiet evening together sharing<unk>es and desserts. Nor could I have conceived, after having multiple people help call the ambulance, which never came, or the friends who called my in-laws to come take care of the kids, that we would be eating a wonderful pizza by the end of the evening. No, none of these things would have prepared me for the relief I would feel, after waiting 4 hours in the emergency room, that her pains were probably only intercostal<unk> pains and the tests for something more serious were all negative. Honestly dear, next time just ask me. I’ll say yes. </s>"
"I cannot agree with the statement that there is ""no future for public transport"" given that the <unk> is ""travelling by car is more convenient"". First of all, public transport is rather more convenient than a private car. The subway reaches most parts of London, and people can travel to many places. The accessibility is not just improving underground, but also on the ground and <unk>. Therefore, public transport will have a brilliant future.</s>"
"That’s my dream"" when I joined the faculty of languages and translation I was very happy because I had achieved my dream. In this faculty, I faced some problems with my English. I began to ask ""How can I improve my English?"" all of the answers were, ""you have to listen and read so you can write and speak well"". I said okay I have to depend on myself. I began to join groups on Facebook where I found some of the people shared their knowledge with others. I followed them immediately. I am on my way to improving my English. I ask<unk> to guide me to the right way. My dream is that I want to open a Center for Language Learning, to teach children and adults in my country good English, and I want to avoid traditional education. The best thing that can encourage me to open this center is that I have 5 friends in my country who study in the faculty of languages and translation and I think that they will be very happy about joining me in my center. I know that is a really amazing dream, but I pray to<unk> to give me all the means to achieve my future dream.</s>"
"Dear Sir, I am writing in response to your advertisement on the noticeboard in our language school inviting applications for the post of Club organiser. I am a forty-year-old secondary school teacher of Art and I believe I have qualifications that you may be looking for. I have been teaching students for approximately 15 years. I used to run summer camps and art workshops. Working with groups of people fills me with lots of energy and, as they need me, I need them too. I have been studying English for several years and I am preparing to take the FCE exam soon. I enjoy participating in debates. I would describe myself as a good listener and a fluent speaker with a strong ability to control discussion. Apart from an ability to get on well with people, I read a lot. I am a big fan of American and British films, from classic to modern ones. I go to the cinema regularly to stay in touch with new <unk>. If you would like to take my application further, then I would be pleased to hear from you. Yours faithfully, Miss Barbara Gum </s>"
"I normally dream but don't remember when I wake up. One day I dreamt that I was a millionaire. I bought a huge detached house surrounded by tall trees in a beautiful city, maybe in a city like Seville. The house wouldn't be located in the city centre because of the traffic and the parking spots, but it wouldn't be situated too far from downtown. My dream house would have two floors, a big garage and, of course, a blue swimming pool bordered by a beautiful garden full of plants and trees, and with a white path from the outside door towards the<unk>. Inside the house, there would be enormous French windows with long curtains and stylish and practical furniture. Downstairs, there would be 5 bedrooms with big beds, 2 bathrooms, one of them with a Jacuzzi, a beautiful kitchen with an American fridge (one of those that have 2 big doors) and a table in the center, where I could eat with my family, and a pleasant living room with two or three large sofas. Upstairs, there would be a games room where I could play with my nephews, nieces and my daughter, another bathroom, a little office to work and to study English, and finally, a huge room called “the cinema-room”, with several comfortable seats and a giant screen where my friends and I could watch our favourite films. </s>"
"Every human has points of strength and weakness. So, humans, both women and men, should behave according to these points. The question which arises now is should the employer hire women for some posts and exclude them from others, and the same for men? There are two answers to this question. The first one is from those who say that it is right to exclude women from some jobs. For example, a builder needs physical strength to carry<unk> and bricks. A mechanic should have the ability to deal with the drawbacks of the job. The second answer is that it is not correct to exclude men or women from any posts. The explanation of those who support the second answer is that everyone is born equal in terms of duties and rights. So no one can hire someone or give anyone a job according to gender.</s>"
"I completely disagree with the statement ""there is no future for public transport"". I do believe that with time people become more conscious of the idea of cities being convenient for everyone. Although a private car is more convenient for its owner than public transport, it is not in use the majority of the time and that means wasting city space on parking while it could be used as a public space. At the same time, it is not impossible to solve the task of comfort and<unk>icacy simultaneously. For instance, a network of taxi cabs with affordable prices could combine the comfort of a personal car and the work-<unk> of public transportation. Nowadays, all the car manufacturers have accepted the task of designing a robot-driven car that in future would resolve the issues of safety and availability of taxis 24 hours 7 days a week. But how is it possible to persuade citizens to make the right choice? Unfortunately, the main method is to make private cars, if not a luxury, then to make their usage economically less efficient compared to public transportation. And the underground, and light tram system are still more ecological and faster.</s>"
"All in one - come and watch Have you ever been asked to make a decision and choose only one thing out of many that you really like? I am sure you have. And then you always wonder what would have happened if you had chosen the alternative. Maybe you just missed something really special... You do not particularly like that feeling, do you? There is a group of young people who decided once that it is ridiculous to choose if you can have all in one - do you want to meet them? Actually, you will have a chance soon. The Red<unk> Theatre Group is coming to our town next week. They will bring a lot of good sense of humour, music, dance, and anything you can think of that should appear on stage. Their main concern is to make you think, laugh, maybe cry a bit, but above all, to give you a great time. I bet you will love them at first sight. To cut a long story short - you must not miss this event! The group is going to perform in The<unk> theatre and they have promised to meet your expectations. The choice is obvious this time...<unk>, come and watch. </s>"
