"People often forget how important it is to help save the environment on a day-to-day basis, yet I believe it is not only the first step, but the most important to public awareness. Living in a big city, I can cycle to work every day, which I believe is a great way to exercise and reduce my environmental footprint. Besides, cycling along a canal allows me to witness flowers and trees blossoming and chicks growing up, reminding me of the beauty of nature. However, I believe that it is at home that I contribute most to saving natural resources; we are, obviously, very careful with turning off the taps when we wash our hands, brush our teeth and so on, and we recycle as much as possible. Yet, our most rewarding action has been starting a compost. We feed worms our food and organic waste, which has drastically decreased it. Moreover, we now use the compost for our garden patch and cacti. Another good point: we have converted our next door neighbour! Composting has made us more aware of our waste and the amount of packaging in the items we buy. I'd definitely recommend it to everyone, whether they live in a flat or in a house with a garden.</s>"
"Nowadays what we most need is to find ways to prevent childhood obesity because nowadays it is a very common sickness that attacks more and more children every day, causing them to feel bad about themselves. According to the <unk>, the percentage of children aged 6 to 11 years old has increased from 7% to about 18% in 32 years in the United States. This means that in the past three decades, obesity has more than doubled in children, <unk> diseases just like diabetes, asthma, cardiovascular risk factors, mental health disorders and musculo<unk> problems. This disease is not just about all the physical and health consequences that sufferers have, but also the mental ones. A lot of kids grow up with a different way of thinking just because of the damage that children can cause. One example is the famous ""bullying"", the principal method that kids use to annoy the ones that look different. The best way we can prevent childhood obesity is by recommending all families a special doctor that can help them to give a safe life to their children. Nutritionists are specialists that know a lot about all the types of sickness that can attack children and even the ones that will kill them. Giving them the opportunity to take care of you and your situation will change all your life in a good way. They can be there for you, preparing menus and a big <unk> of exercises that will help you and change your health and body, but only if you cooperate. </s>"
"Nowadays, higher education is becoming more and more necessary for starting a good career. Let's consider the attitudes to education and study in Russia and Australia. There are some similarities. However, differences in the educational system cause differences in the attitudes to education. University education is valuable in Australia, just like in Russia. In general, most employers prefer applicants who have achieved an academic degree. This attitude is quite similar in many countries.</s>"
"Set in in late<unk>s France, Cho<unk>t deals with the topic of society discriminating against different people because of their being different: whether they are gypsies, women that don’t depend on men, or people that don’t share the Christian faith. The plot revolves around Vianne<unk>r, a single mother and chocolate expert, opening a ‘cho<unk><unk>’ right before Lent in a small, closed-minded French village, the mayor of which decides to boycott her. During Lent, the protagonist gets to know other outcasts (mainly women) and helps them. However, Vianne must learn to solve her own problems and change the course of her own life. One of the strengths of the film is its star-studded cast:<unk>ette Bi<unk>e as Vianne,<unk> Molina as the mayor, Judi Dench as a <unk>mpy, elderly woman <unk> the oppressing society of the village, and a young Johnny Depp as a handsome gypsy arriving in town with his<unk>. Each and every one of the roles is beautifully written and the actors don’t fail in bringing them to life. Besides the cast, I would like to highlight the original soundtrack. It suits perfectly the theme of the movie, with a little bit of jazz man<unk>, a popular genre amongst European gypsy communities, and reminiscences of Mexican folklore, as the recipes Vianne<unk>r prepares in the ‘cho<unk><unk>’ are a heritage from her Mayan ancestors. If I had to find a downside to Cho<unk>t, it would be that the film format does not allow us to have a deeper look into some of the characters and their story lines. Had it not been written in the year 2000, but today, I am sure that this story would have been turned into a successful TV series in which we could have learnt more about the past and the future of those fantastic characters. All in all, this is a gripping, moving, and entertaining film that will make you reflect on some social issues. A must-see if, like me, you enjoy cinema with strong female characters in the lead roles, but you do not necessarily want to watch another dramatic story. </s>"
"Sometimes we do things we don't want to for no apparent reason but some other times we know exactly what we are getting into. Michael had cheated on her and he did it consciously. There was no way to shine a different light on that fact. He tried in his mind to go back to that moment, when his lips were getting closer to Jane, to that last look before the embrace, to the previous smile. There was no one else to blame but him.<unk>ret had been filling up his soul since last Friday. He could not keep his betrayal inside any longer, so he went into the living room and told her. The words coming out of his mouth like a<unk>any, almost mechanically, as he realized that there was no turning back. Tears ran down Rachel's face. No words, not a single comment. She just stood up, took her purse, and left. The relief of telling her was instantly replaced by a bitter<unk>ness. He now realized. He didn't do it for her, he only did it for himself, to get rid of his burden, but it was far too late. Michael closed the door and knew at that moment he had made a mistake.</s>"
"I do agree television advertising directed toward young children should not be allowed for several reasons. First, this kind of advertisement should be forbidden on account of the fact that young children are still very vulnerable. Kids around these ages (2 to 5 years old) do not have a mature critical sense and anything can easily persuade them. For instance, when I was three years old, I used to be <unk>d by all the toys which were presented in TV commercials just because of the way they were presented. One of them was ""the ultimate<unk> steel"", which was about a hundred dollars. Secondly, I am also opposed to the <unk> of this advertising because of the severe consequences it has on the parents' and child's relationships. It is common to see parents having issues with their kids because of this kind of commercial. Many parents have an unhealthy relationship, or even a wrecked relationship, with their kids. One example is what happened to my cousin Patricia when she had her first child, called Sophia. One day, Sophia got really excited about an advertisement for a barbie doll and she could not think about anything else than having this toy. Unfortunately, my cousin did not have enough money to buy it, but her daughter - a three-year-old kid - did not understand it and got angry with Patricia, not speaking to her for three weeks! In conclusion, I am strongly in favour of this statement.<unk>ments for young kids, not only upto 5 but upto 8 years old should be forbidden because of the kid's vulnerability and the risk to their parents' relationships with them. Finally, if the advertisements are still broadcast, it is essential some educational politics comes with them, valorizing and teaching kids about understanding their parents.</s>"
"In my life, many dreams have existed in my mind which are sweet, incredible, magical or horrible. However, one of my dreams stays in my heart so that I can't ever forget it. One night, as usual, I was sleeping. In a flash, I rolled down a mountain and I didn't know where I was. It was just a very long tunnel that was dark and strange. After, I felt my body ache. I began to yell and hoped someone could help me to leave there. F<unk> minutes passed, and my body was no longer sore. I decided to walk to the end. <unk>, I just walked <unk>. While I struggled to walk, finally, I saw a light appear and I woke up. <unk>. It makes me feel that it was a strange dream. </s>"
"Dear Chris, I would like to spend this Saturday with you)) Hope you will be free at 6 a.m. Let's meet at John's apartment. His party is always fun. All our friends will be there.</s>"
"The phenomenon of homeless people has become a serious problem and many countries cannot solve this problem. The number of homeless people is increasing not just in the developing countries but all over the world. In my opinion, homeless people are victims because nobody wants to live without shelter. First of all, being without a home is a horrible problem. One of the major reasons for this problem is wars, especially in the Arab countries like Syria,<unk> and<unk>. Every day on the news we see refugees who are living in miserable conditions. They live in tents that do not protect them from cold weather or dangerous insects. They do not have enough food. In addition, financial crises. Most companies have financial problems, so the ideal solution to them is downsizing. After a while, the people who are laid off will not have enough money to live and they will become homeless people. Furthermore, street children are a result of family troubles.<unk>s of divorce are increasing and many children run away and prefer to live in the streets instead of in a home full of problems. <unk> the idea above, some people believe that homeless people are criminals and they cause danger to our society because they need money and food so they might steal or kill for this. To conclude, the world has a complicated problem, so governments and charitable organizations must take a quick decision and put in place a real solution to solve this problem. Homeless people are human beings and they must have their rights in life. </s>"
"There is an increasing trend towards private transport so that public transport will be reduced in the future. Ultimately, public transport will be negligible in the future. There are so many reasons that could affect the public transport system. The main one is that nowadays people are incredibly busy with their day to day life, so that they don't like to spend their valuable time waiting for regular transport. Also, public transport causes lots of pollution which is harmful for human beings. For example, lunchtime travelling is very dangerous for pregnant women due to emissions of carbon monoxide, which affects red blood cells and irritates the respiratory system. As a result, they prefer private transport systems to prevent such hazards. Finally, the public transport system is not always safe. To illustrate, if teenage girls travel by public transport every day <unk> it is a big challenge for them. </s>"
"Hi Ke<unk>, Hope you are doing well. As per our discussion earlier on the Service<unk> Sales communication, I would like to ask you if you have already started to prepare the background and sales communication materials for this service guide and how to use it. We are aiming to deliver the Service<unk> materials in Week 25 to the marketing colleagues for translation and localisation. The countries will have 6 weeks to localise and produce it (till Week 32). Following our communication to the marketing community, ideally we should also inform the sales community about the sales communication materials and guidelines. I propose having a meeting to discuss the process/timeline and<unk> our communications to the marketing and sales community. Would you be available to meet on Monday, June <unk> Looking forward to hearing from you. Kind regards,</s>"
"Hello Jane! Here is a picture from last summer when we were in Halland on an island called Nidingen! My name is Lorin and I am 13 years old. I live in Djursholm at Riddarv<unk>gen<unk>, close to a field. I was born on August 4 at the hospital in Danderyd. In my family there are five people; my mom Malak, my dad Claes, my little sister Novalie and my little brother Edvard. Novalie is 10 years old and Edvard is 6 years old. In my spare time I like to be with friends and I do also play soccer, dance and ski. I really like to do sports because I like to be outside. I compete in skiing and I think it's great fun. I often go skiing in <unk> re, Vemdalen and in Ramundberget. Once every year, I ski with my ski club (T<unk>by slalomklubb) in Switzerland. In Switzerland we have been to Saas fee and Zermatt. In Zermatt you can see the<unk>horn (the mountain that you see on Toblerone packaging). It is a very cool mountain. I do also ski with my family and that is the best. I like slalom because it goes fast and I like snow. In the summer holidays, my family and I just spend time on the west coast on a small island called K<unk> lhuvudet. That is one of our summerhouses. I love to be there because when we are there we swim in the ocean and we fish for crabs and just have a lot of fun. You can, of course, see the ocean and it is very beautiful. Something else I like to do is shopping. My parents call me a shopaholic and I almost agree. I like it because it is fun to look at clothes and try them on. I read quite a lot and my favourite book is Harry Potter. I like fantasy and that book is fantastic. If it was possible to go to Hogwarts I would do it. Now you know what my favourite book is, so you can almost guess what my favorite movie is... Of course, Harry Potter. But I do also like a movie called The Game Plan. It is about an American football player who doesn't know</s>"
"In my opinion, public transport in my country will never improve, because my country is so poor and, besides, it is considered one of the Third World countries. And another thing that must be taken into consideration is that the politicians are horrible. They have destroyed my country.</s>"
"There is no doubt that travelling by car is the most comfortable option, but claiming that public transport has no future is too much. Many people use public transport on a daily basis. There are people who wouldn't be able to travel if it wasn't for public transport. Children and elderly people can't have a driving license, so if they need to go somewhere, using public transport is their only option. Travelling by car is also very detrimental to the environment. In big cities, the air is very polluted because there are too many cars. Travelling by public transport reduces the impact on the environment, something that most people are aware of, but still they prefer to use their own vehicle. Using public transport can also save time, since you don't have to spend time looking for a place to park your car. I definitely think that public transport will continue to be very important in the future. </s>"
"One day Michael woke up from a strange dream, the dream was focused on a camera that was following a shadow in front of it. Everything was dark except for a ray of light that probably started at the end of that <unk>. The shadow kept walking and running from what Michael supposed was a threat. Michael was confused, he didn't know why he had dreamed that. He thought it would be better to forget about it, so he stopped thinking about his dream. That day Michael had to go to work, so he got up from his bed and went to his bathroom. When he was ready, he took his keys and everything he needed, he locked the door and went to his job. He took his car and drove to the <unk>. When he arrived at the building where he worked, he took the elevator and went to his floor. Since he had entered the building he had had a strange feeling. When he arrived at his office, Michael closed the door and knew at that moment he had made a mistake.</s>"
"Hello Stefan! How are you? Hope everything's fine. Everything here is great. It's been so long since we last talked... and I have some great news! Well, I'm writing to tell you that this summer I'm coming to the UK, and I'd like to hang out with you for some time! It'll be the second time I've visited the UK, and I don't want to do the same excursions, so would you mind telling me some good activities to do or some places to visit there? Also, I'd like to invite you to my house here in Spain. All my friends and I are having a party and it would be fantastic if you were able to come. Hope to see you soon Love, Rosa </s>"
"Dear Sir or Madam, I am writing to apply for one of the jobs in the summer camp that you advertised on the Internet. I am in my final year of high school, which I will leave with a university entrance qualification in July of this year. I am looking for a job in the USA to improve my English and to gain more experience working with children as I want to become a primary school teacher. I have babysat children of different ages for the last 4 years and have found that very satisfying so far. In addition, I have privately <unk> 5th and 6th grade pupils in Mathematics, English, German and French for the last 3 years. The people I have worked for find me a reliable, communicative, well-organised and cheerful person. I have been told that I am quite good with children. My babysitting duties were to put the children to bed, provide lunch or dinner, play with them and read to them. With regard to the tutorials. I have put together my own exercise materials, looked at and discussed class tests and helped the pupils with their homework. Since I have worked twice as a group instructor at a local summer camp, I think that I am well-<unk> to deal with 8-12-year-old children from the experience I mentioned. I hope you will invite me for a job interview, via Skype or in person, and look forward to hearing from you soon. Yours faithfully, Tessa Fo<unk></s>"
"The collapse of the<unk> Union has become one of the defining events in the world’s history. It influenced the further development of post-So<unk>t countries as well the as<unk>political situation in the whole world. It has also influenced international relations not just within thepost-So<unk>t area, but also in the entire world, as the period after the collapse of the USSR was marked by a crash of bipolar structure in international relations. Since for fifty years the world lived under the shadow of the Cold War, fearing a fatal confrontation between the US and the<unk> Union, the dissolution of the USSR had a huge<unk> not only in the US mass-media but also in American society. The American press had widely covered the revolution in the Baltic States and the tension which had been spread across the<unk> Union after the fall of the Berlin Wall, as well as the fall of communist governments within the whole former<unk> Bloc. The tensions in the<unk> Union came to their peak in August<unk>. While Gorbachev was on vacation in the Crimea, a group of right wing military and K<unk> leaders staged a<unk> in Moscow. The ""New York Times” made a series of publications dedicated to the<unk>. They were published under the common title “So<unk>t crisis”. The articles headlined “So<unk>t crisis”<unk> described the situation in the capital of Russia. On August 20, the “New York Times” published an article which contained the<unk>s from the news conference held by Acting President<unk>nadiy<unk>ayev and four other members of the State Committee for the State of<unk>. The American press, summing up the era of Gorbachov, frequently highlighted his attempts to increase the openness of<unk> society. Those attempts were considered as one of Gorbachov’s main merits. “The buried secrets of past regimes and the foibles of the present one were exposed to public scrutiny by the press"" – the New York Times wrote. The plotters immediately encountered strong opposition from the leadership of the R<unk>SR leaders under the guidance of President Boris Yeltsin. Tens of thousands hit the streets in Russia in order to defend democracy.<unk>sive actions by Yeltsin were supported by most world governments and international communities. Boris Yeltsin gained international acclaim when </s>"
"Hi Jo! I heard you are going to come to my country. I am writing to you to give you some advice about work and travel in my country. In Poland we have a lot of interesting places to visit. Places that you can visit: mountains, sea and lakes. We have a lot of nice old towns. Poland is an amazing and interesting country. If you <unk> in Poland, the best way is <unk>. If you have experience of cooking, you will be the right person for this job. Hope you come soon. See you! Love! XYX</s>"
"Humans prefer a luxurious life. Public transport is a bit uncomfortable. With the coming of cars, people use public transport more rarely. Everyone prefers to have his/her own car, so the future of public transport is very dark. This is an alarming issue that needs to be addressed as soon as possible, because if everyone uses his/her car, pollution will increase and that will eventually affect every living being.</s>"
"Stem cells are undifferentiated biological cells that can differentiate into specialized cells and divide to produce more stem cells. They can also treat or prevent a disease or condition, and are used by scientists in research, and by doctors. I think it is a really good idea to use stem cells in order to save other people's lives, even if they come from an aborted foetus. There are a lot of people in this world that are ill and need stem cells in their healing process, so parents that had an aborted foetus should let the scientists and the doctors use the stem cells in their research and help other people. Science nowadays has developed a lot and has given the population a lot of possibilities, like storing stem cells and using them to treat future health problems anyone can have. All in all, I suppose a lot of people disagree with this subject because it is not a good idea for them, but in my opinion, it is a really good idea to save other people’s lives by taking stem cells from an aborted foetus. </s>"
"Dear Mrs Ashby, I am writing to you about the job offer for work in Green Pepper Cafe. I would like to apply for this vacancy because I think I have most of the requirements that you are asking for. First of all, cooking has been my passion for ages. I enjoy learning new recipes and I try to find different flavours and sensations when cooking. That is why I am looking for a job where I could have the chance to combine my love of cooking with my job. I worked for more than six years in a supermarket as well, so that is why I am accustomed to dealing with customers and coping with difficult people in a busy environment. It is not necessary to say I am able to work to a cafe schedule. I have experience working shift days and weekends. I would be glad if I could have an interview to give you more details about my work experience, my skills or whatever you need to ask me. Yours sincerely </s>"
"It had been a very long and tiring day, but Tom felt he had achieved something really good. Tom had faith this day would be better than the others. He hadn't recovered yet from the last scare he had that day. He sat on his chair and looked out of the window. ""....."" he looked at his hands. He was shaking. He shook his head and looked at the ceiling. He started to do his homework, but he had trouble concentrating as the memories came back to his mind. ""I can't...do it"", he slammed his head on the desk. ""I can't."" He looked at the bathroom door and walked over to it. He turned the lights on to see his face. The same face as always. When he looked down, he saw something on the floor. It was a note. ""Tom. Tom. Tom. Tom,"" it said. That scared him. It couldn't be him again... He turned the note to see something. ""1992-2015"". He felt it again. The same feeling he had when he saw it. He fell backwards and when he looked up, he saw it again. ""Tom. You are impolite. You are late for your death date"" </s>"
