"My most memorable learning experience to date was my marriage. My ex-husband taught me not to get involved with some kinds of people by analyzing his behavior before <unk>. During our courtship he was very charming and attentive. We discussed some sexist ideas that I don't agree with about what society demands of people and I noticed a little sexism in him, but I was fine with that because that can happen. But due to my profession, he couldn't be like that for so long, because I was in a man's shoes. He was very jealous, but I thought it would fade away with time and with the gaining of trust, but it did not and ended up making me sick as the time passed. I learned that a man does anything to conquer a woman. He even does a lot of hateful things for him, such as going to her home every night to be together or to hang out, while later you find out that he hates going to places except his house. I learned a man says anything just to shut you up and not discuss things, just to have some love moments. He does not end an argument and give a position to understand your point, he thinks he is right and does not want to think about it. I also learned that men think in a different way from women during the day. For example, while women think about millions of things like what they want to do or have to do during the day, men just do not think about anything and can be like that for hours, just with a blank mind. But, in my opinion, this should be an excuse to think something that women shouldn't know anything about. I also learned that it is the mother that gives the principles and the direction of a man's mind, and depending on her, he is going to be a sexist or not, he is going to help and be an honorable man or not, he is going to be a good and caring father or not, he is going to be a responsible human being or not. A mother is absolutely fundamental and the basis for the man's principles and beliefs. Women do not know their importance for the future in their own homes. They teach the same things over and over again and do not rethink whether those beliefs and actions are really right to help the world change and be</s>"
"Dear Marco, I am sorry to hear that you’ve got to give up either sport or music. I know how much you like both activities so I suppose you are having a hard time. Soccer has always been part of your life and memories of you as a kid kicking a ball bigger than you are still vivid in my mind. I still remember the first day we went to attend a soccer lesson. You promised me you would never give up! You dreamt of becoming a professional player and decided what your life would be like once you achieved it. You’ve kept working on it for almost your entire life now and, although you have not become a professional one, you have never given up. However, piano is also part of your life. When I first introduced you to it, you were quite sceptical of your possible achievements. But again, you never gave up and now you play in the 3rd<unk> in Town, which shows how big you are. Proof not only that you are very determined, but that piano playing was meant to be. We have enjoyed music together for nearly 20 years and most of our good times are related to that. As you asked for my take, what I tried to do was nothing but think of you as if you were my son. I imagined the scenario with Mathew coming up to me and looking for some advice. First off, I would take him on a long journey by car. I’d suggest we take some days off together and head for any particular place he would like to go to. Then, once we got on the car, I’d let the music we had planned before as the ideal background absorb us before uttering any words. Only after driving for a while would I ask him to tell me what he’s been up to lately and if there’s anything he hasn’t told me about but is keen to mention now. At that point, I would let his talking go on without stopping him through<unk>. I’m convinced he’d speak his thoughts at once without beating around the bush and all his fear and doubt would slip out. By now, he will be able to answer for himself many questions he’s been troubled by. All I’d have to do is just point out what the main points are that he is too <unk> to see. Because that’s what an outside <unk> is needed</s>"
"Dear Jo, I am really happy you wrote to me for some advice and I am very honoured that you want to spend some time in my country. Now you have got lots of free time and I think that you must do a really good tour of my country. First, you have to decide if you want to visit the north or the south part of Italy, because if you do a full immersion tour of the entire Peninsula you will visit only half of all you have to visit. If you decide to visit the north part, I think it would be good if you started from<unk>o and its new museum of nature called Muse. It is very beautiful because it is<unk> like a mountain (and so you can start from the top floor and then you go down, visiting other floors). Then you must visit my city, Milan. There you must see the center of the city because we have the Dome (the cathedral), the gallery near the Dome, the little hidden church called S.Satiro and, at the end, Sforza's castle. Then you must visit Venice, the city on the water where every part of the city is a little treasure. If you like Egyptian history, you can go to Turin, where you can find a huge and beautiful museum of Ancient Egypt. If you want to visit the south part of Italy, you must start your trip from Florence, the birthplace of the culture. Then you must go down to Rome, the capital city of my country. After you have seen the Coliseum, the basilica of S.Peter and the Trevi fountain, and so on, you must visit Naples. In that wonderful city, you must visit the statue of Jesus Christ called "" il Cristo velato"" made of marble, and then you must visit the centre of the city, full of fantastic features that make this city really special, like<unk>ccanapoli,<unk> Napoli, S.<unk>naro's treasure, S.Severio Church and so on. If you are a little bit tired of all this touring, you can go to Sicily, where a beautiful and special landscape welcomes you. There are lots of things to visit in Sicily and the most important cities are: Palermo, Messima, Siracusa, Noto,<unk>usa, Trapani, Agri</s>"
"A high number of tourists visit Cáceres searching for culture, heritage and typical food from Extremadura. For that reason, this town has a lot of facilities to meet that demand and to offer a good time too. The most attractive resource in Cáceres is its heritage. The old town is an historical and cultural center where a great part of the tourism is focused. This part of the city is ready to receive tourism because there is intensive control on access to the old town by car. Anyway, taxis and official vehicles are free to use whenever you want. One of the most characteristic things about this region is the food and Cáceres is the top city of gastronomy in Europe. Currently, Cáceres is the only Spanish city having a European award for offering a wide selection of food and drink. ""Atrio"" is the most important restaurant in the city and it has been recognised with two stars by the most famous guide for restaurants in Spain. Anyway, ""Atrio"" is not just a fine food restaurant, but it is a five-star hotel in the middle of the old town. Also, Cáceres has a great <unk> if someone wants to buy other things like clothes, souvenirs and art.<unk>tores Street is the commercial place of the city and it has a great selection of shops and restaurants with typical food from Spain.</s>"
"I'm 24 years old, so I belong to the previous generation, when family, school and life in general worked in a different way, from my point of view. I have a wonderful family, made up of my father, my mother and my two siblings (a sister and a brother), both older than me. I consider myself lucky because I know I can always count on them, and because they love me as much as I love them. However, this doesn't mean that my parents, especially when I was a child, always told me ""yes"" and let me do whatever I wanted to. On the contrary, I grew up with many ""no""s, and I do not always agree with them in different situations. But they taught me all the important values and good manners, and I'm grateful to them for that. Because nowadays I see around me kids who are pleased in every way by their parents: they buy them whatever they want, and behave like ""friends"". I believe that this is wrong, because by doing so they're not doing their job well. Parents must be parents, and friends must be friends. This doesn't mean that parents should keep themselves distant from their children; on the contrary, a child should talk to their family, asking for advice or just <unk> each other, because communication is at the basis of relationships of every kind. I just think that each of us in our life plays a role, and that being parents is not an easy job, but they should try to do their best.</s>"
"It is well known that an image is better than a thousand words, and that may be the reason for the success of television in a recent survey as the most important invention of the last 100 years. However, this choice may not be the wisest, as there are other inventions more useful than television and with better future applications. I am referring to the Internet.<unk> in the 1970's as a military project to inter<unk><unk> facilities and the central headquarters, it soon spread to universities and educational centers. This fact, along with the spread of personal computers, quickly led to a generalization of its use in the first decade of the XXI century. Nobody wants to dismiss the importance of television and its achievements. For more than 50 years, it has been the main entertainment channel, disp<unk>ing others like radio, theater, cinema and, sadly, also books. In its first years, television was also an important channel for culture (theater plays, classic films, etc.). Unfortunately, in recent years, television has lost this educational focus. The Internet, on the other hand, has become more and more popular, not only for entertainment, but also for business, and today it is almost impossible to find an activity in which the Internet doesn't play a major role. The Internet has also replaced television for watching films and TV shows, especially among young people, who prefer to download and watch videos instead of watching to the fixed schedule of TV.</s>"
"Next Monday, I am going to India. I love India so much. My friend went there. She talked to me about it so much. Indian people make amazing food, but it's so spicy. Indian people dance in an amazing way. India is the seventh biggest country in the world by area. In India, it rains from June to September. It was my dream to go there one day. I am going to visit Delhi and Tajmahal.</s>"
"Welcome tourists, This is a guide for you. I hope it will help you a little. First of all, I want to explain travel links with the town. A lot of people come by train, It is situated at the top of the town and is the best way to travel to <unk> because it is the quickest, but if you prefer to come by bus, the bus stop is near the train station. There are many shops around the town. For example, we have one where children can make teddy bears while the parents can see them from the restaurant; many children said that it was the best place in the world. For adults, we have a little old museum where you can live one day like sixty years ago. So, if you have never been in one, you should go, because it does not cost very much. Besides, the museum has a kindergarten for the kids. Apart from that, the town is near the beach, and there we have many restaurants where you can eat while you are watching the waves on the sea. Our personal recommendation is the ""Sir Hotel"". It is a <unk> hotel because many years ago it was a castle, and you can sleep in the king's bed and every night it has theatre, where you can take a part in a play. </s>"
"My name is Kamaldeen. I'm 31 years old. I'm married and I don't have children. I moved with my family from Jordan to Saudi Arabia in 1995. I began studying when I came to Saudi Arabia in third grade. I grew up in Al Qassim region and I had the best time of my life in Al Qassim. I have a big family <unk> from my father and mother and I have seven brothers and three sisters. I studied at Al Qassim University and my major was Microbiology. I graduated from my college in 2001. After that, I got a job at the Ministry of Health and I have been working there since 2010. I like a lot of activities, such as travelling, reading, playing soccer and watching movies. </s>"
"The doorbell rang. When I opened the door, imagine my surprise! In front of me stood a Hare<unk>! I was alone in the office, it was late and I had a lot of work to do and when I heard the sound of the doorbell I felt really upset because I was looking forward to going home. Anyway, the man was wearing an orange costume, he was surprisingly tall and slim and he was completely <unk> except for a long black ponytail coming out of his head. He seemed the most <unk><unk> man in the world, so I wasn’t afraid. On the contrary, I felt pretty amused when he started dancing, prancing and singing an unknown song. It was really hard not to burst out laughing in his face! When he stopped, he gave me a coloured bracelet and said that it would make me happier. I was so glad to have had this comic moment that I gave him a little gift and I invited him to come back again! </s>"
"16 May 2014 Dear <unk>, I am writing in response to your advertisment for SUMMER CAMPS. I am very interested in the job, because I would like to work for you this summer. I could start whenever you like. I worked as an assistant chef in a<unk>k Restaurant last summer. I worked in another restaurant in London, but I would like to look after children, because I have studied to be a teacher. Also, I have worked in other summer camps, which are<unk> Camp, Nature Camp, etc. My CV is enclosed. I believe I am suitable for this job, because I enjoy working with children and I know how to cook very well. Also, for me, the salary is not a problem, because my motivation is to learn. I look forward to hearing from you. Yours faithfully. Juan Antonio</s>"
"My first memories of food are from my early years, as I looked at my grandmother cooking typical Spanish dishes such as paella or<unk>. When I was in school I used to go to my grandparents' home to have lunch because my parents were at work. I fondly remember my grandma's great cooking skills that she still has to this day. She <unk> d cook the best<unk>, paella and all of the typical Spanish dishes that I <unk> ve ever eaten. A few years afterwards, right when I started high school and hit my teenager years, I began eating bigger amounts of unhealthy food from American fast food restaurants that I used to go to with my friends some days right after class and during the weekends. Those years I was very familiar with the smell of cheeseburgers, BBQ pizzas and kebabs. By the time my high school years were done, and when I attended university, I developed a certain predi<unk> for typical healthy Spanish food, unavoidably combined with less fast food due to the usual dinners with friends. The main cause of that change was that I had to have breakfast, lunch and dinner in my college dorm <unk> s dining room, which had amazingly good cooks. They <unk> d cook really good dishes such as co<unk>o, garbanzos and paella. </s>"
"Hi everyone, my name is J<unk> and I have a wife and a little child. My wife's name is Maritza. She is 30 years old. She is a beautiful and joyful woman. My son's name is Rafi. He is 3 years old. He is a very handsome and fun child. My wife likes to go out when she is free. She likes to visit touristic places. My son likes playing sports. He is very little but he plays football. He is a very active child.</s>"
"Due to the ever-increasing population<unk> with climate change, food shortages have become a significant problem facing many countries. Some assert that genetically modified food technology could be applied to address this problem. This essay will argue that genetically modified food could be the way out of the problem of food deficit and this will be done by focusing on its environmental benefits and increased food yield. Firstly, GM food can have a positive impact on the problem of food safety. It is well known that GM food is <unk> with various resistance genes, such as pest disease resistance genes. This means that the food, being more resistant to pests and agricultural diseases, we can<unk> the use of chemical pesticides and fertilizers that can poison the water supply and pollute the environment. This reduction in the application of chemical products can create a safer agricultural environment, ensuring food safety. Furthermore, GM food can also improve the production of crops. Due to the various new traits resulting from the GM technology, such as drought tolerance and salinity tolerance, GM food can ensure food production in a period of drought. This could be important for food production, especially in developing countries. However, some may argue that it is also questionable whether GM food has a detrimental impact on human health. Actually, thousands of tests on GM food, before bringing it onto the markets, have proven that it is harmless to both the environment and human health. In conclusion, it is evident that GM food can increase food yields with a reduced use of chemicals. In view of this, it is reasonable to believe that GM food might be an ideal strategy to alleviate the problem of food shortages. However, because there are some disadvantages to the GM technology which is being developed, it is also recommended that governments should give more importance to the management of GM food.</s>"
"This report aims to present different advertising strategies for our products according to the type of customers we have. In addition, I will recommend the best kind of advertising for our needs. First, to have a successful campaign, it is important to know the target market. A survey about the kind of customers for our product revealed that most of them are young adults. This means that they are between 20 and 30 years old. After studying our advertising options, it was found that two of them could be suitable for our purpose. One way is to put advertising on the internet and use social networks. On the other hand, we could set up stands in shopping malls. In order to obtain maximum benefit from this, it will be helpful if we give away product samples. As I mentioned above, the advertising campaign must be appropriate to the target market. I therefore feel justified in recommending that the campaign in shopping malls would be more effective for us. This is mainly because, besides it being cheaper, customers will become familiar with the product. In conclusion, we have different options for this campaign. If we choose the appropriate kind of advertising for our product, I can assure you that we will succeed.</s>"
"My town tries all the time to make our town more beautiful and comfortable by taking more care of the environment. They provide us with good buses, which are friends to the environment, and offer the tickets for these buses at a cheap price. They also try to find the best way to make the rubbish more useful by recycling. Also, people try all the time to find the best way to keep our village clean; they never throw the rubbish in the streets or the gardens. They also take care of the fuel in their cars to not be bad for the environment. So, it's our duty to take care of our village and the whole environment alongside the government.</s>"
"I think that there isn <unk> t a future for public transport because, nowadays, people usually use their own private car. This has some advantages, such as it being more comfortable and faster. When you travel by bus, you must have a timetable and it is less comfortable than travelling by car, whereas when you go by car you can take your car whenever you want. Sometimes, private transport is cheaper if you go with other people. For example, when you go by car you can go with other people, so you pay less money for petrol. On the other hand, private transport is damaging for the planet and we must take care of the planet. We can help to prevent the pollution of the environment if we take public transport, which doesn't pollute. At the moment, there is more than one car per person. That is a problem for me because people don <unk> t take care the of<unk>ment. They prefer to be comfortable. In conclusion, using public transport causes less damage to the environment <unk>.</s>"
"Dear Sir or Madam I have seen your English courses on the internet and suddenly I thought that's what I need! My name is Mike, I'm 23 years old and I want to learn more English because I love this language and because I need it for my next job in the summer. At the moment, I am living in Germany, but if I could come to your English course, then I would find another place to stay. That's no problem! I want to ask some questions about the course. How much are the costs and how often will we have the lessons? I hope it will be every day because I'm looking forward to learning English! I would be grateful if you could reply to my questions as soon as you can. If you have any questions, please don't hesitate to contact me. Thank you very much. Best regards Mike</s>"
"In this set of materials, the listening passage discusses the advantages of alcohol and how it contributes to improving health and personality, and the reading contradicts this by revealing the downside of it. In the listening passage, the professor discusses the advantages of alcohol and how it helps to reduce heart attacks and strokes by 40 percent, due to the fact that it reduces blood clots and slows down the deterioration of brain function. In addition, moderate drinking helps to maintain healthy <unk>, because some research has shown that people who drink moderately have a lesser proportion of body fat, because alcohol speeds up the metabolism, which makes calories burn quickly. Moreover, it is stated that people who drink moderately have positive social behavior, which means that they are more likely to establish contact than non-drinkers, and they are more social, popular and they are more likely to be married. On the other hand, the reading contrasts with this by mentioning the disadvantages of alcohol. Firstly, it is stated that alcohol leads to weight gain, because it has more calories per gram than any other drink, and it is mentioned in the passage that you need to walk a mile to lose the calories of a glass of wine. Furthermore, studies have shown that alcohol stimulates the appetite, which makes people consume more than they need. For example, researchers have found that belly fat is related to alcohol. Second, alcohol can cause some serious health issues, especially cirrhosis of the liver, heart failure, brain damage and a variety of cancers. Third, people who drink alcohol tend towards aggression and violence. In fact, studies show that <unk> percent of all homicides and 60 percent of sexual assaults are linked to alcohol. </s>"
"Dear Mr Wallis, Thank you so much for this opportunity. I am very grateful for everything. I think English is, in fact, very important because, first of all, despite not being the most spoken language in the world, it is the official language in a large number of countries. Most of the content produced on the internet (50<unk> is in English and, last but not least, although learning English can be challenging and steals some of our precious time, we can see that it is also very valuable to learn and can also create many opportunities. About the accommodation. We talked and decided that we would prefer to be with English-speaking families because of the great opportunity it is for everyone to actually test their speaking skills. This is a once in a lifetime opportunity and I am certain that we will cherish every second of every minute there. I was actually about to email you about the activities that are being planned. Regarding the students' preferences, they all love the outdoors, like parks and rivers, and they also love a good museum because of their thirst for knowledge. All in all, anything that will keep them away from being bored and having nothing to do. Concerning this amazing trip, I only have two questions left starting with the weather, considering your experience with the changes happening at this time of the year, and the second and last, about what type of clothes you recommend, which is of great importance primarily to our female students. Yours sincerely Margaret<unk>n</s>"
"It is known that the Internet makes things easier than ever and can be used for everything. Some people believe that we can’t even live without it. One of the advantages of the Internet is that we can meet new people around the world and make friends without talking face to face. There are plenty of websites where you can search for people, meet them and chat with people with the same interests. I have very good friends thanks to the Internet. However, there is a lot of<unk> software around the Internet and you must be careful. You shouldn't do silly or illegal things, because you will be exposed to this<unk> software. In addition, that software is created by nasty people that create these viruses to damage other people's computers. In my opinion. I must <unk> the facilities given by the Internet. It’s all so easy and useful. For example, you can order a pizza to be delivered to your home. To sum up, I totally agree with making friends through the Internet. </s>"
