"Nowadays, we are in the age of the internet. A flat world is created by the internet. We can get knowledge more easily and we learn more easily, too. This is the power of information technology. The social networks, such as Facebook, Twitter,<unk>, Google plus... are connecting us to more and more friends, companies, public figures, books, films, social organizations.... We really have a lot of things to see, to think, to ""like"", to ""comment"" on and dozens of other ways that we can <unk> to interact with others. So, maybe it is true that we have less time to think about ourselves, to take care of our health. They help us to communication with the world and we have only twenty hours a day. We know more things but we lose more time for many other interesting things. <unk> information technology and related fields such as: communication. On the other hand, we still have a lot of other technologies to create a lot of useful machines, <unk> services to make our life better and better day by day. Transportation helps us go abroad more quickly, even go into space on a tour. It is amazing for you, if you have enough money, to pay for that tour. We feel more happy, comfortable and refreshed after something like that. Biotechnology gives us more food. Chemistry gives us more tablets. Yes, we are solving many problems with our technology <unk>, our health and our finances, too. You can join any stock market in the world to buy some Google<unk> and sell some Facebook<unk> too, and earn some money. You take the world in your hands with technology to make your life better and better actually, but it is not <unk></s>"
"I'd like to introduce myself: I'm Italian with an obsession for the English language I can't stop studying the English language. I'm a sort of 'English addict', but I wish I were an English native speaker, I don't know why. I studied English at school. Later I took my degree in Modern Foreign Languages and Literatures, starting my to and from England to improve my skills. While studying at University, my idea was to move to the UK to work there, but I got married so I couldn't realize my dream! I found myself teaching English in my country, far from the language competence I longed for. I will never stop visiting the UK and trying to improve my speaking and writing skills. Thanks, too, to your help.</s>"
"Dear<unk>, Hi, How are you? Honestly, I do not like nature programmes so much because they are so boring! I personally like sports programmes and comedy shows, because I love sports and also enjoy having a good laugh. My favourite TV shows are ""Hablemos de Football"", ""Sports Center"", ""Fox Sport"" and ""The Simpsons"". All these except ""The Simpsons"" are about sports, mainly football, basketball and rugby. And as a sports lover I am glad to be informed about the latest matches of the international leagues like the ""NBA"", ""Premium League"" and also the ""<unk> League"" because of my deep love of sports. I watch TV about 5 hours a day and at the weekends for about 6 hours because I can stay in bed till late. I watch some football matches <unk> and comedy shows. What about you? How is everybody there? What is your favourite programme? And I would like to know what is the most popular programme among teenagers in your country. I hope you will write back soon. Love,<unk>aro</s>"
"It was a beautiful Sunday morning and Michael was preparing to go out to meet his old friend Peter. He was running to the cafe where they were supposed to meet. Peter was already there and he immediately told Michael about a trip to Italy that he had planned for them. Everything sounded great, they only needed a little bit more money and a car. Michael thought that he could use his father's car, and borrow some money from his mother. He knew that Peter was a little bit irresponsible, but he thought that the arrangement sounded perfect and nothing could go wrong. He managed to get the money and take the car from his dad and went to pick up Peter. He got to Peter's apartment to help him with his luggage. He was thinking that this time it would be different, everything was planned and they would have a great time. He opened the door and saw that Peter wasn't packed at all, he had changed his mind about the trip. Michael closed the door and knew at that moment he had made a mistake.</s>"
"It is undoubtedly true that in today's modern world people commute to work mostly in their private vehicles. It seems more convenient to them to get around on their own rather than be tied to public transport. It can be argued that public transport systems have been losing their popularity in many ways. People feel that they can get to their destinations on time if they drive their own car. It is true in many cases, as public modes of transport like buses, trains and trams, have their own specific routes and stops. This may cause people to get to their particular destination late. Secondly, public transport seems to be getting more expensive day by day, which has reduced its popularity. People therefore find cars more affordable for them. In modern society, cars have become cheaper to buy, which in turn has helped people to have them. Moreover, many car finance companies have made it easy for every individual to purchase a car. In conclusion, I would say that, due to recent progress in society, there has been a considerable increase in car ownership. It can therefore easily be<unk> that there will be no role for public transport in the future.</s>"
"At present, many people think that English is the world language and it is absolutely an essential skill to communicate with people from other countries. For this reason, Taiwanese parents do not want their kids to be behind others. Therefore, many kindergartens have started to teach children English. </s>"
"The person I most admire is called Ronaldinho, a football player who, in my opinion, is the best of all time. He won only one golden ball, but he should have won more than that. He mostly played in the number 10 even though he also played in numbers 80 and 45. He was born in Porto Alegre, in 1980, and played in several teams, like Barcelona and AC Milan. The skills he has are wonderful. He knows everything about football, his passes were fantastic, he passed the ball even with his back! Even though most people think that Messi or Ronaldo Nazario are even better than him, other people think the same as me.</s>"
"Is it convenient to take a year off between leaving school and starting the university? I think it is not necessary and not recommendable because you have the possibility to earn money and it is difficult once you get used to earning money, you want to study again. Also, if you want to travel, you have to make money for that and then travel. Furthermore, you don't study during this period and when you want to start university, you won't be able to remember some important things So, if you take a year off, you have to think about it.</s>"
"Dear Sir, My name is Natalia Maciejewska<unk><unk> ónez and I am a citizen of Castellón. I am writing this letter to inform you about a serious problem that we are having in the city. Recently, things have been disappearing from our homes. We have called the police, but they ignore us. The first few days, they patrolled the city and helped us. However, now it seems that they do not care what happens. The police should help and make sure that we are safe, right? That is why I am writing this letter, to let you know what is happening in the city and to tell you that the police are not doing their job. I would like the local town council to help us find out what is happening. People are afraid and we need help urgently. I would also like you to talk to the police department, because the police have to do their job and make sure we are all safe, not ignore us and say that everything is fine when everything is wrong. Thank you, Natalia</s>"
"Funding for the English Language Club As the secretary of the English Language club, I am writing this proposal to persuade you as to why it would benefit both the students and the college if we received funding from you. </s>"
"Dear Camp Director, I would like to work at the summer camp this year. My name is<unk>, I am 14 years old and I can speak English. I love summer camps because you learn so much in them and have wonderful experiences too. Looking after children is one of my favorite things to do and many people tell me I am good at it. I have experience of looking after children. I am always willing to help with anything. I can be very creative when it comes to fun things. I took cooking classes last year, so I can also work in the kitchens. I think it is very important for children to have fun in the summer camps. On the other hand, they should learn something new in a summer camp. And they need someone to help them and guide them through it all. Kindest regards,<unk> </s>"
"Dear Mr..., First, I want to present myself. My name is Daniela and I'm 16 years old. My English is improvable but by speaking I hope that I'll do it well. I think that I'm good for this job, because I really socialize with children. I like organising activities and games to make people enjoy their time. I'm a cheerful person, so I would attempt to give my best to keep the attention of the children. Also I'm very responsible and hardworking, so I would take care of the children and I would do my tasks the best I could. Finally, I want to say that this is an important opportunity for me to learn and to do new things. It's a wonderful adventure. Sincerely, Daniela<unk>i </s>"
"Importance of outdoor games As we know, every person wants to achieve success in their lives. For this, they must lead a healthy life.<unk> games are made just for this purpose. That is, to make a person healthier. In ancient times, every child loved to play games outside their homes and they were stronger than children in today's world. There are many games that children can play, like cricket, badminton, football etc. Our world's great scientists have invented the internet to solve various <unk> problems. Students have started to forget their physical games and get stuck in this internet world. They are spending so much time on using the internet and they engage in only meaningless gossip on social networking websites. If they want to use it, they should try to focus on getting important information which is beneficial to improving their knowledge. Using the internet in the wrong way may affect their studies and health as well. By playing physical games, they will not only improve their health but they can also gain concentration. They should try to understand the importance of physical games and also play them regularly.</s>"
"I live in a small city in the middle of Vietnam. This city doesn't have a lot of citizens but it's a tourist city. So in the streets we always have a lot of trash cans. It will help people not throw the garbage in the street. In our city, we have a billboard to urge people to pay attention to the environment. In the schools, we set up a workshop to tell students how important the environment is to our lives. The citizens of the city want to build the city with the slogan"" The city is green - clean - beautiful"". So they are aware of the need to help the city achieve that. So everyone brings the trash to the place <unk>. Every year we have "" earth hour"". In this hour, many people turn off the lights in their house to save energy and protect the environment. I am very proud of the awareness of my city's people. I wish a lot of people around the world could see the importance of the environment. And they have to act to protect it.</s>"
"We human beings are highly socialized creatures in the world. Therefore, it is inevitable that we have to learn to be part of society. Parents, in some cases, are mentors to children. However, considering the complexity of society, I believe it is better to learn in schools rather than from parents. First of all, there is no denying that parents may teach their children enormous fundamental life skills on which their progeny count. Nevertheless, the skills are not diverse enough for children to deal with specific problems when living in a complex society. For example, one of my senior high school classmates encountered a communication problem in his family. As a consequence, they have never talked to each other since then. Following the previous paragraph, there will always be people with different lifestyles, attitudes, and beliefs in every aspect of one's life. If we have not lived and learned the skills in a group, especially in school, we will not be skilled before entering society. Society as a whole is a place where both competition and cooperation take turns to continuously influence every member. If we only live in our original family, parents will probably forgive us when we make mistakes. In contrast, living in a society is another story: people might blame, compete, or even hurt others, no matter who you are. Learning in schools, however, provides a valuable opportunity for children to learn not only from teachers, but also from relationships between peers, and as a result, p<unk> the way for being independent in the future. In a nutshell, there is a great deal of knowledge that needs to be acquired by children in order to live in society. School, a place with diverse students along with diverse attitudes towards life, might be better than merely learning with parents.</s>"
"I think that family members can't be friends because the relationship is very different. There are many good reasons to say that. Firstly, family is the basis of the relationship. Secondly, although friendship and love are the most important feelings, the family <unk> the person and influences their behavior. I feel about my family in a different way from my friends. Although I have a good relationship with my parents, I couldn't think of them as friends. Some people think that this is possible, but I disagree because it confuses roles in the family. The parents have to give education to the children and, obviously, love. In conclusion, I think that the two relationships are different.</s>"
"According to Berkow<unk>, airway management is one component of anaesthesia procedure to ensure the patient's airway is open. An example of an intervention in airway management is the<unk> mask that Mr.<unk> was using. Also, this practice is the primary consideration for efficient post-anaesthesia care (Scoot, 2012). The majority of patients that have had general anaesthetic, like Mr.<unk>, must recover in a PACU (<unk>-anaesthesia<unk> Unit) to monitor the vital signs, especially the airways management due to the anaesthesia, impeding any post<unk> com<unk> (Scoot, 2012; Farrell & Dempsey, 2011). The first 24 hours post surgery is considered the most critical period, because the patient can present, primarily,<unk> disorders, and the nurse needs to maintain<unk>-respiratory stability (<unk>ov &<unk>iche, 2009).<unk>ing the airway management after Mr.<unk><unk> s admission to PACU, the first procedure that the nurse should carry out, is follow the A-G assessment protocol, to review the stability and the airway <unk> of the patient, sustaining the <unk><unk> to prevent<unk>xemia and hypercapnia (Farrell & Dempsey, 2010). Mr.<unk>’s airway should be <unk> and clear of mucus or blood (Pudner, 2010). Due to the surgery, Mr<unk> is in a supine position, but this position reduces his oxygenation (Snowball, 2012), and can also impede the air passage, This is related to the anaesthesia effect, where the tongue and the lower<unk> fall backward. Hence, he needs oxygen supply to prevent any airway<unk>. Therefore, the oxygen therapy needs to continue immediately along with his admission, via<unk> cannula or oxygen mask within 4 to 6L/min, until the anaesthesia effects are completely gone and the patient’s oxygen<unk> is restored (Farrell & Dempsey, 2010). Thus, Mr.<unk> is being given O2 via<unk> mask 6L/min, because he received general anaesthesia and all of his muscles are relaxed and, at the moment, he does not have control over his<unk>es (Farrell & Demps</s>"
"About me! Hey, my name is Mathias. I was born in Danderyds hospital but lived in Stockholm. When I was four, I moved to Danderyd. I have a big brother. He's 14 and goes on Friberga as well. His name is Ulric and he's in 8f2. My favorite activity is football. It's great fun to play it with all my friends. I also like to play floorball but it isn’t as fun as football. I also like to play video games. I play with my friends. My favourite games are<unk>,<unk>, GTAV and some others. I have lived in stockholm and in two houses in Danderyd, but no other places. I don’t know which is the best place I have been to but New York was cool, but I actually like F<unk> <unk> most. It is an island next to Gotland and I have been going there since I was 0 years. We always rent a little cottage from a sheep farmer and now we know his family. We always go to the beach, which is very nice, and when it’s sunny and warm it is better than the Mediterranean. I don’t know what I’m proud of, but when I score a nice goal, I am proud because it feels good, especially when it’s an important goal that maybe will change the game. I would like to be the best football player in the world, a Youtuber, or take over a big company. It is often hard to get up in the morning. I always think just one more minute and then I fall asleep. I asked my parents and they said ambitious, curious and considerate. I don’t know if I can agree with that but I listened to them. :) I don’t know what I like people to know about me. That I danced for two years, but I stopped because I didn’t have time. I would like to play a World Cup game and I also want to win the<unk> League. I don’t have a favourite movie. I like many but the movies I like the most are comedies and action adventure. I don’t read many books. I like a lot of songs, but I think it’s Let’s Do It Again by J Boog because I like the singer's voice,</s>"
"Dear Jo, Romania is a beautiful country and has many jobs. Also, there are many places to see, mountains and lakes where you can relax and have fun. The jobs are nice and you can work for three months. There is good pay also. I also work in the summer as a waitress in a <unk>. It is good and people are nice. See you soon.</s>"
"First of all, I lived in London for three weeks in 2012. I am a teacher in a high school and the authorities in my country let me stay there, improving my English. I would like to say that learning any language is complicated for anyone, wherever you come from, but, in my opinion, there are many matters to discuss. A good illustration of this would be children. A child whose parents come from different countries is able to learn two languages at the same time. This child doesn't need to go abroad to learn a foreign language, because they are listening to their parents speaking English, their native language, all the time and this lets them learn without any difficulty. On the other hand, if you go abroad you will be able to improve your English in an an<unk>phone country. In this case, your knowledge will be<unk> by your stay there. To sum up, if you want to learn English, you don't need to go abroad. You can improve your English by working hard in your own country, for example, by doing exercises like listening and writing, or you can meet with native people who speak English to practise with them. But if you have an opportunity to go abroad, it would be so good for you and your English.</s>"
"Dear Paul, Last month, as you may know, I was a volunteer on the occasion of my favourite band's concert in Katowice. It was just a miracle - it had turned out that the band's manager was my good old friend, Daniel, and he asked me for help when he found out I was a big fan of the group. Although the work was truly demanding and lasted for quite a while, I must say I really enjoyed it. Firstly, I had to be involved in it a month before the event started. I was asked to give some information about the concert to local pubs, restaurants etc., so I was handing out leaflets everywhere. By the time the event was due to take place, I had to take over the band's equipment. I had to move it from place to place along with the boys from the group. One thing led to another and we ended up having a beer and laughing in a pub. <unk> the concert came off just perfectly! Lots of people showed up, everybody had fun and the best thing in the musical experience is that you can make friends with famous people and those who you admire and only see on TV. If you ever have an opportunity to help at this kind of event, I recommend it to you from the bottom of my heart! Looking forward to hearing from you. Yours sincerely, Patrycja.</s>"
"Introduction The aim of this proposal is to present suggestions regarding the ways in which the extra funding could be used for the benefit of the students and, indirectly, for the benefit of the local community. Needless to say, in order to combat the rising<unk> of social problems in<unk>, the Education<unk> decided to increase funds for the educational sector. Sports Club Sporting activities might boost the students' overall condition and this is the reason why they are necessary. It is well known that physical activity contributes to improving physical and mental health. Drama Club This kind of club will allow students to express their feelings in a non-<unk>ent manner, learn how to manage their reactions and develop creative talent. A drama club will make examining plays such as Shakespeare's more enjoyable than solely studying them will. Cookery classes Cookery classes are very important because students here are young adults that need to have basic skills such as cooking in order to manage themselves and live an independent life. Cooking classes will help students spend less money on eating out and they will start eating more healthily because by making their own food they will be more aware of what they are eating.<unk> Classes ""Do it yourself"" classes improve practical skills. As most college students will soon leave for university and will live in dorms, without their parents, they are obliged to fix malfunctions by themselves. The information they acquire during these courses will help them for the rest of their lives. Citizenship classes Another kind of classes that are necessary are<unk> classes as teenagers nowadays are deficient in this field. These courses will develop the civic sense of students and they will start getting involved actively in society. Conclusion The overall purpose of these actions is to keep young adults in school and to educate them. The Education<unk> believes that social problems are linked with a decrease in participation in extra-curricular activities and it suggests that the college should use extra funding to solve this issue.<unk>ing clubs and courses such as the ones mentioned above would ensure the improvement of the situation.</s>"
"Dear Ira! Thanks a lot for your letter. It was fun to read as always. Your new friends seem to be crazy guys. In a good way, of course. I was so surprised to hear you signed up for a new interior design course because it’s such a coincidence that I’m planning to do something with my bedroom in the near future. As I’ve got some extra money at last, I think It’s high time for me to think about how to make it cozy and comfortable. I hope you don’t mind if I ask you some questions. First, I am thinking about painting the walls in warm colors (apricot, salmon pink or warm be<unk>). I thought you might add some more interesting colors to the list. Do you think a wall<unk> is a good decision for the bedroom and what other ""special effects"" would you recommend? I completely rely on your taste, as we’ve always been on the same<unk>. Now, the toughest questions. I’ve got no idea what to do with the ceiling. The idea of painting it white seems too boring to me and I’m completely out of my depth with all this new stuff for ceilings in shops, but I’m sure you’re an expert! The floor is also a problem. I want it to look beautiful, be easy to wash and not expensive at the same time. I’m wondering what you would suggest. I hope I'm not bothering you too much with my redecoration, knowing how busy you are. Can’t wait to hear what you’ve been up to this weekend. All the best Natasha </s>"
"How to learn English It's proven that to learn a foreign language, you have to go abroad. You can study hard for years, but if you aren't obligated to use English for everyday things, you won't become good at it. There aren't other options. Of course, studying in a foreign country also has disadvantages. First, it costs a lot. Even though there are lots of different possibilities and scholarships, not everybody can afford them. Living abroad, even for a short time, could be very stressful and people can feel homesick. Despite that, there are more reasons to study abroad. It is a very useful experience in many ways. You will learn better and faster than studying at home. In addition, visiting new countries and meeting new cultures, helps to open your mind and to foster a lot. I have done several school trips in the past few years and I'm going to do it again for sure.</s>"
